id,category,sub,question_text,option_1,option_2,option_3,option_4,correct_answer
78,Phishing,BEC_and_quishing,What potential risks are associated with scanning a fraudulent QR code?,Entering login credentials on a phishing site,Installing malware on your device,Automatically sending money to attackers,Permanently damaging your device's camera,"[""option_1"",""option_2"",""option_3""]"
79,Phishing,BEC_and_quishing,Why can quishing attacks be more challenging to detect than traditional phishing?,QR codes are harder to scan for malicious content,Quishing emails never contain text,QR codes can't be blocked by email filters,Quishing attacks only target IT staff,"[""option_1""]"
80,Phishing,BEC_and_quishing,What unique security challenge does quishing pose for organizations?,It only affects Android devices,"It can involve multiple devices, including personal ones",It can't be detected by any security software,It only works on company Wi-Fi networks,"[""option_2""]"
81,Phishing,BEC_and_quishing,Which of the following are common warning signs of a quishing attack?,Misspellings and grammatical errors,Lookalike email addresses,A sense of urgency in the message,The presence of company logos,"[""option_1"",""option_2"",""option_3""]"
82,Phishing,BEC_and_quishing,What should you do after scanning a QR code from an email?,Immediately enter your login information,Check the URL before browsing to it,Forward the email to all your contacts,Download any suggested apps,"[""option_2""]"
83,Phishing,BEC_and_quishing,How can enabling Multi-Factor Authentication (MFA) help against quishing attacks?,It prevents all QR codes from being scanned,It automatically deletes suspicious emails,It reduces the impact if credentials are entered on a phishing site,It blocks all incoming emails with images,"[""option_3""]"
84,Phishing,BEC_and_quishing,What should you do if you receive an email with a QR code from an unknown sender?,Scan it immediately to check its content,Forward it to your IT department,Don't scan the QR code,Print the email and scan it with a different device,"[""option_3""]"
85,Phishing,BEC_and_quishing,Which of the following can help an organization prevent successful quishing attacks?,Educating employees about the risks,Using email scanners,Banning the use of all QR codes,Disabling cameras on all company devices,"[""option_1""]"
86,Phishing,BEC_and_quishing,Why might a quishing attack sent to a personal email be a risk for companies?,Personal emails are always more secure,"It could be scanned on a business device, potentially infecting it",Personal emails automatically forward to work accounts,QR codes in personal emails are always malicious,"[""option_2""]"
87,SSRF,SSRF,What is a common indicator that a server-side request forgery (SSRF) attack might be occurring?,Receiving unexpected responses from internal services,An unusual number of login attempts from a foreign IP address,The server making requests to unknown or local addresses without user input,Employees reporting phishing emails,"[""option_1"",""option_3""]"
88,SSRF,SSRF,Which action should you take if you suspect a URL provided in an email is part of a phishing attempt?,Click the URL to verify its authenticity,Report the email to your IT department,Forward the email to a colleague for their opinion,Delete the email immediately without reporting,"[""option_2""]"
89,SSRF,SSRF,Which of the following URLs could potentially be used in an SSRF attack?,https://www.google.com,http://localhost/admin,https://yourcompany.com/profile,http://127.0.0.1:8080,"[""option_2"",""option_4""]"
90,SSRF,SSRF,How can you protect your application against SSRF attacks?,Implement a whitelist of allowed URLs,Rely on blacklisting specific IP addresses,Disable unnecessary URL schemes like file:// and ftp://,Ensure all backend services are on the same network,"[""option_1"",""option_3""]"
91,SSRF,SSRF,Why should you avoid clicking on links from unknown sources?,They could lead to malware or phishing sites,They might initiate an SSRF attack,They can automatically log you out of your accounts,They could slow down your internet connection,"[""option_1"",""option_2""]"
92,SSRF,SSRF,What makes internal services particularly vulnerable to SSRF attacks?,They are often behind firewalls and not exposed to the public internet,They usually have stronger authentication methods,They are accessed frequently by external users,They are typically not designed to handle untrusted input,"[""option_1"",""option_4""]"
93,SSRF,SSRF,What should you do if you accidentally click on a suspicious link?,Disconnect from the internet immediately,Inform your IT department and follow their instructions,Close the browser and delete your browsing history,Restart your computer and hope for the best,"[""option_1"",""option_2""]"
94,SSRF,SSRF,Which of the following could be a sign that an application is vulnerable to SSRF?,The application allows users to submit URLs for server processing,The application uses HTTPS for communication,The application has a user-friendly interface,The application stores user data securely,"[""option_1""]"
95,SSRF,SSRF,What is the primary goal of an attacker using SSRF?,To execute arbitrary code on the target server,To retrieve sensitive data from internal services,To disrupt the server's normal operations,To gain administrative access to user accounts,"[""option_1"",""option_2""]"
96,SSRF,SSRF,Which of the following best practices can help mitigate SSRF vulnerabilities?,Only allow necessary outbound requests from the server,Implement strong password policies,Use network segmentation to isolate critical services,Log all inbound and outbound HTTP requests for auditing,"[""option_1"",""option_3"",""option_4""]"
97,SSRF,SSRF,"If your company’s application is vulnerable to SSRF, what could be a consequence?",An attacker could access internal services not meant for public use,The application could stop working entirely,Employees might lose access to their emails,All user data could be encrypted by the attacker,"[""option_1""]"
98,SSRF,SSRF,How can SSRF attacks affect cloud services?,They can provide access to cloud service metadata,They can allow unauthorized access to cloud-based APIs,They can help attackers control cloud service configurations,They can slow down cloud service performance,"[""option_1"",""option_2"",""option_3""]"
99,SSRF,SSRF,Which of the following actions can help prevent SSRF attacks on web applications?,Validating and sanitizing user input that includes URLs,Using encryption for all web traffic,Disabling automatic URL redirection in the application,Ensuring regular software updates are applied,"[""option_1"",""option_3""]"
100,SSRF,SSRF,Why is it dangerous for a server to process user-submitted URLs without proper validation?,It can lead to SSRF attacks where internal resources are exposed,It might cause the server to crash,It can create duplicate records in the database,It might lead to slower server performance,"[""option_1"",""option_2"",""option_3""]"
101,SSRF,SSRF,What should you avoid doing if you receive an email that seems suspicious?,Clicking on any links or downloading attachments,Forwarding it to your colleagues without reporting it,Replying to the sender for more information,Reporting it to the IT department,"[""option_2""]"
102,SSRF,SSRF,Which network architecture practice can help limit the impact of an SSRF attack?,Using a flat network with all systems on the same segment,Employing network segmentation to separate critical resources,Deploying servers without firewall protection,Allowing unrestricted access between all internal services,"[""option_1"",""option_2""]"
103,SSRF,SSRF,What is a common way attackers might try to bypass SSRF defenses?,"Using alternative IP representations, such as 2130706433 for 127.0.0.1",Increasing the frequency of requests to overwhelm the server,Using a VPN to hide their IP address,Spoofing their IP address to appear as a trusted source,"[""option_1""]"
104,SSRF,SSRF,Why is whitelisting URLs more effective than blacklisting when protecting against SSRF?,Blacklists are more easily bypassed using obfuscation techniques,Whitelisting ensures only trusted URLs are accessed,Blacklists are harder to maintain and update regularly,Whitelisting completely eliminates the risk of SSRF,"[""option_1"",""option_2"",""option_3""]"
105,SSRF,SSRF,"If an SSRF vulnerability is exploited, what type of data is at risk?",Internal service configurations and metadata,Public-facing website content,User passwords stored in plain text,Network traffic logs from external sources,"[""option_1"",""option_2""]"
106,SSRF,SSRF,What should you do if you suspect that a web application might be vulnerable to SSRF?,Report your suspicion to the IT or security team immediately,Try to exploit the vulnerability to confirm it,Avoid using the application and inform your colleagues to do the same,Contact the vendor or developer of the application for further investigation,"[""option_1"",""option_4""]"